<?xml version="1.0"?>
<!--
Sites visited:
https://msdn.microsoft.com/en-us/library/ms757863(v=vs.85).aspx
Slides visited:
edc.02d.pdf
-->
<CompanySales xmlns:xsi="http://www.w3.org/2001/XMLSchema-instance" xsi:noNamespaceSchemaLocation="bakery_sales.xsd">
	<Company>
		<CompanyId> 513581332 </CompanyId>
		<TaxRegistrationNumber> 513581332 </TaxRegistrationNumber>
		<CompanyName> PADARIA PASTELARIA SARGACAL LDA.  </CompanyName>
		<BusinessName> PADARIA PASTELARIA SARGACAL LDA. </BusinessName>
		<CurrencyCode>EUR</CurrencyCode>
		<Address>
			<BuildingNumber> </BuildingNumber>
			<StreetName> </StreetName>
			<AddressDetail>RUA 15 DE MAIO, 735</AddressDetail>
			<City>Válega</City>
			<PostalCode>3880-503</PostalCode>
			<Region> </Region>
			<Country>PT</Country>
		</Address>
		<Contact>
			<Telephone> </Telephone>
			<Fax> </Fax>
			<Email> </Email>
			<Website> </Website>
		</Contact>
	</Company>

	<CompanyProducts>
		<Product>
			<ProductID>01</ProductID>
			<ProductName>Pão</ProductName>
			<UnitCost>0.105</UnitCost>
            <Tax>
                <TaxType>IVA</TaxType>
                <Description>Taxa Reduzida</Description>
                <TaxPercentage>6</TaxPercentage>
            </Tax>
		</Product>

		<Product>
			<ProductID>02</ProductID>
			<ProductName>Pastéis</ProductName>
			<UnitCost>0.40</UnitCost>
           <Tax>
                <TaxType>IVA</TaxType>
                <Description>Taxa Normal</Description>
                <TaxPercentage>23</TaxPercentage>
            </Tax>
		</Product>

		<Product>
			<ProductID>03</ProductID>
			<ProductName>Croissant</ProductName>
			<UnitCost>0.37</UnitCost>
            <Tax>
                <TaxType>IVA</TaxType>
                <Description>Taxa Reduzida</Description>
                <TaxPercentage>6</TaxPercentage>
            </Tax>
		</Product>

		<Product>
			<ProductID>04</ProductID>
			<ProductName>Bicos de Pato</ProductName>
			<UnitCost>0.37</UnitCost>
            <Tax>
                <TaxType>IVA</TaxType>
                <Description>Taxa Reduzida</Description>
                <TaxPercentage>6</TaxPercentage>
            </Tax>
		</Product>

		<Product>
			<ProductID>05</ProductID>
			<ProductName>Broa de Milho</ProductName>
			<UnitCost>1.70</UnitCost>
            <Tax>
                <TaxType>IVA</TaxType>
                <Description>Taxa Reduzida</Description>
                <TaxPercentage>6</TaxPercentage>
            </Tax>
		</Product>

		<Product>
			<ProductID>06</ProductID>
			<ProductName>Bolo Rei</ProductName>
			<UnitCost>8.80</UnitCost>
            <Tax>
                <TaxType>IVA</TaxType>
                <Description>Taxa Normal</Description>
                <TaxPercentage>23</TaxPercentage>
            </Tax>
		</Product>

		<Product>
			<ProductID>07</ProductID>
			<ProductName>Regueifa</ProductName>
			<UnitCost>1.10</UnitCost>
            <Tax>
                <TaxType>IVA</TaxType>
                <Description>Taxa Reduzida</Description>
                <TaxPercentage>6</TaxPercentage>
            </Tax>
		</Product>

		<Product>
			<ProductID>08</ProductID>
			<ProductName>Pão de forma</ProductName>
			<UnitCost>1.50</UnitCost>
            <Tax>
                <TaxType>IVA</TaxType>
                <Description>Taxa Reduzida</Description>
                <TaxPercentage>6</TaxPercentage>
            </Tax>
		</Product>

		<Product>
			<ProductID>09</ProductID>
			<ProductName>Pão de ló de Ovar</ProductName>
			<UnitCost>10.00</UnitCost>
            <Tax>
                <TaxType>IVA</TaxType>
                <Description>Taxa Normal</Description>
                <TaxPercentage>23</TaxPercentage>
            </Tax>
		</Product>

		<Product>
			<ProductID>10</ProductID>
			<ProductName> Sandes queijo fiambre </ProductName>
			<UnitCost>0.75</UnitCost>
            <Tax>
                <TaxType>IVA</TaxType>
                <Description>Taxa Normal</Description>
                <TaxPercentage>23</TaxPercentage>
            </Tax>
		</Product>

		<Product>
			<ProductID>11</ProductID>
			<ProductName> Água mineral sem gás </ProductName>
			<UnitCost>0.40</UnitCost>
            <Tax>
                <TaxType>IVA</TaxType>
                <Description>Taxa Reduzida</Description>
                <TaxPercentage>6</TaxPercentage>
            </Tax>
		</Product>

        <Product>
			<ProductID>12</ProductID>
			<ProductName> Bolo de aniversário </ProductName>
			<UnitCost>9.50</UnitCost>
            <Tax>
                <TaxType>IVA</TaxType>
                <Description>Taxa Normal</Description>
                <TaxPercentage>23</TaxPercentage>
            </Tax>
		</Product>

        <Product>
			<ProductID>13</ProductID>
			<ProductName> Pão da avó </ProductName>
			<UnitCost>1.65</UnitCost>
            <Tax>
                <TaxType>IVA</TaxType>
                <Description>Taxa Reduzida</Description>
                <TaxPercentage>6</TaxPercentage>
            </Tax>
		</Product>

        <Product>
			<ProductID>14</ProductID>
			<ProductName> Pão de mistura </ProductName>
			<UnitCost>0.105</UnitCost>
            <Tax>
                <TaxType>IVA</TaxType>
                <Description>Taxa Reduzida</Description>
                <TaxPercentage>6</TaxPercentage>
            </Tax>
		</Product>

        <Product>
			<ProductID>15</ProductID>
			<ProductName> Pão integral </ProductName>
			<UnitCost>0.105</UnitCost>
            <Tax>
                <TaxType>IVA</TaxType>
                <Description>Taxa Reduzida</Description>
                <TaxPercentage>6</TaxPercentage>
            </Tax>
		</Product>

        <Product>
			<ProductID>16</ProductID>
			<ProductName> Fogaças </ProductName>
			<UnitCost>3.50</UnitCost>
            <Tax>
                <TaxType>IVA</TaxType>
                <Description>Taxa Intermedia</Description>
                <TaxPercentage>13</TaxPercentage>
            </Tax>
		</Product>

        <Product>
			<ProductID>17</ProductID>
			<ProductName> Folares </ProductName>
			<UnitCost>6.00</UnitCost>
            <Tax>
                <TaxType>IVA</TaxType>
                <Description>Taxa Intermedia</Description>
                <TaxPercentage>13</TaxPercentage>
            </Tax>
		</Product>

        <Product>
			<ProductID>18</ProductID>
			<ProductName> Miniaturas de pasteis </ProductName>
			<UnitCost>0.35</UnitCost>
            <Tax>
                <TaxType>IVA</TaxType>
                <Description>Taxa Normal</Description>
                <TaxPercentage>23</TaxPercentage>
            </Tax>
		</Product>

	</CompanyProducts>

	<CompanyClients>
		<Client>
			<ClientID>01</ClientID>
			<ClientName>Agrupamento de Escolas de Ovar</ClientName>
			<ClientAddress>
				<AddressDetail>R. Dom Dinis</AddressDetail>
				<City>Ovar</City>
				<PostalCode>3880-000</PostalCode>
				<Region> </Region>
				<Country>PT</Country>
			</ClientAddress>
			<ClientContact>
				<Telephone>256581000</Telephone>
				<Fax>256586411</Fax>
				<Email>esjmf@portugalmail.pt</Email>
			</ClientContact>
		</Client>

		<Client>
			<ClientID>02</ClientID>
			<ClientName>Agrupamento de Escolas Ovar Sul</ClientName>
			<ClientAddress>
				<AddressDetail>R. Irmãos Oliveira Lopes</AddressDetail>
				<City>Ovar</City>
				<PostalCode>3880-192</PostalCode>
				<Region> </Region>
				<Country>PT</Country>
			</ClientAddress>
			<ClientContact>
				<Telephone>256502347</Telephone>
				<Fax>256503246</Fax>
				<Email> </Email>
			</ClientContact>
		</Client>

		<Client>
			<ClientID>03</ClientID>
			<ClientName>Confeitaria Convívio 2 Paiva e Correia L.da</ClientName>
			<ClientAddress>
				<AddressDetail>Rua das Palreiras - Válega</AddressDetail>
				<City>Ovar</City>
				<PostalCode>3880-000</PostalCode>
				<Region> </Region>
				<Country>PT</Country>
			</ClientAddress>
			<ClientContact>
				<Telephone> </Telephone>
				<Fax> </Fax>
				<Email> </Email>
			</ClientContact>
		</Client>

		<Client>
			<ClientID>04</ClientID>
			<ClientName>Restaurante Paradise</ClientName>
			<ClientAddress>
				<AddressDetail>Rua Alexandre Herculano</AddressDetail>
				<City>Ovar</City>
				<PostalCode>3880-000</PostalCode>
				<Region> </Region>
				<Country>PT</Country>
			</ClientAddress>
			<ClientContact>
				<Telephone>256575661</Telephone>
				<Fax> </Fax>
				<Email> </Email>
			</ClientContact>
		</Client>

		<Client>
			<ClientID>05</ClientID>
			<ClientName> Junta Freguesia de Válega </ClientName>
			<ClientAddress>
				<AddressDetail>Av. Comendador António Augusto da Silva</AddressDetail>
				<City>Válega</City>
				<PostalCode>3880-000</PostalCode>
				<Region> </Region>
				<Country>PT</Country>
			</ClientAddress>
			<ClientContact>
				<Telephone>256575661</Telephone>
				<Fax> </Fax>
				<Email> </Email>
			</ClientContact>
		</Client>

		<Client>
			<ClientID>06</ClientID>
			<ClientName>Estabelecimentos Alentejano António Álvaro da Silva Matos</ClientName>
			<ClientAddress>
				<AddressDetail>Rua das Estradas nº 678</AddressDetail>
				<City>Válega</City>
				<PostalCode>3880-508</PostalCode>
				<Region> </Region>
				<Country>PT</Country>
			</ClientAddress>
			<ClientContact>
				<Telephone>256502090</Telephone>
				<Fax> </Fax>
				<Email> </Email>
			</ClientContact>
		</Client>

		<Client>
			<ClientID>07</ClientID>
			<ClientName> Centro Cultural e Recrea. de Válega </ClientName>
			<ClientAddress>
				<AddressDetail>Rua do Centro Cultural e Recreativo de Válega</AddressDetail>
				<City>Válega</City>
				<PostalCode>3880-503</PostalCode>
				<Region> </Region>
				<Country>PT</Country>
			</ClientAddress>
			<ClientContact>
				<Telephone> </Telephone>